{
  "schema_version":"1.0.0","algorithm_id":"tins","name":"Tins","full_name":"Threshold Computation in the Head Signatures from Normalized Subfield Bilinear Collisions","version":null,"function":"digital_signature","submission_path":"DigitalSignature/Tins","aliases":[],
  "overview_classification":{"family":"mpc_in_the_head_based","subcategory":"other_mpcit_h","family_label_en":"MPC-in-the-Head","family_label_zh":"头脑中多方计算","subcategory_label_en":"Other MPC-in-the-Head","subcategory_label_zh":"其他MPC-in-the-Head签名","summary_label_zh":"头脑中多方计算 / NSBC型TCitH签名"},
  "technical_classification":{"construction_paradigm":["identification_to_signature","fiat_shamir","mpc_in_the_head"],"hardness_problems":[{"name":"NSBC","role":"unforgeability","details":"Normalized Subfield Bilinear Collision"}],"mathematical_structures":["finite-field extensions","threshold computation in the head","all-but-one vector commitments"],"claimed_security_targets":["EUF-CMA"],"claimed_security_models":["ROM"]},
  "signature_characteristics":{"statefulness":"stateless","signing_randomness":"randomized","signature_length":"fixed","message_recovery":false,"rejection_sampling":false,"prehash_mode":null,"context_support":null,"batch_verification":null},
  "affiliations":[{"affiliation_id":"aff-1","name_en":"CETC Cyberspace Security Technology Company Ltd.","name_zh":null,"country_or_region":"China"},{"affiliation_id":"aff-2","name_en":"ShengAnXin Technology Co., Ltd.","name_zh":null,"country_or_region":"China"},{"affiliation_id":"aff-3","name_en":"The Third Research Institute of the Ministry of Public Security","name_zh":null,"country_or_region":"China"},{"affiliation_id":"aff-4","name_en":"Shandong University, School of Cyber Science and Technology","name_zh":null,"country_or_region":"China"}],
  "submitters":[{"name_en":"Xianfang Wang","name_zh":null,"affiliation_ids":["aff-1"],"roles":["author"]},{"name_en":"Renzhang Liu","name_zh":null,"affiliation_ids":["aff-2"],"roles":["author"]},{"name_en":"Shimin Li","name_zh":null,"affiliation_ids":["aff-3"],"roles":["author"]},{"name_en":"Binbin Tu","name_zh":null,"affiliation_ids":["aff-4"],"roles":["author"]}],
  "common_parameters":{"base_field":"F_2","extension_field":"F_(2^k)","challenge_structure":"TCitH repetitions with proof-of-work final challenge","hash_xof_prg":["Hash1","Hash2","Hash3","PRG"],"signature_components":["commitments/openings","TCitH responses"]},
  "parameter_sets":[
    {"name":"Tins-128","implementation_aliases":[],"target_security":{"classical_bits":137,"quantum_bits":null,"category":"128-bit target"},"parameters":{"q":2,"k":276,"n":140,"mu":12,"N":4096,"tau":12,"Topen":125,"omega":6},"sizes":{"public_key":{"value":51,"unit":"byte","status":"reported","notes":null},"secret_key":{"value":32,"unit":"byte","status":"reported","notes":null},"signature":{"encoding":"fixed","reported":3284,"minimum":3284,"maximum":3284,"average":3284,"unit":"byte","notes":null}}},
    {"name":"Tins-256","implementation_aliases":[],"target_security":{"classical_bits":261,"quantum_bits":null,"category":"256-bit target"},"parameters":{"q":2,"k":528,"n":268,"mu":12,"N":4096,"tau":24,"Topen":255,"omega":4},"sizes":{"public_key":{"value":98,"unit":"byte","status":"reported","notes":null},"secret_key":{"value":64,"unit":"byte","status":"reported","notes":null},"signature":{"encoding":"fixed","reported":13012,"minimum":13012,"maximum":13012,"average":13012,"unit":"byte","notes":null}}},
    {"name":"Tins-512","implementation_aliases":[],"target_security":{"classical_bits":521,"quantum_bits":null,"category":"512-bit target"},"parameters":{"q":2,"k":1044,"n":524,"mu":12,"N":4096,"tau":47,"Topen":510,"omega":6},"sizes":{"public_key":{"value":195,"unit":"byte","status":"reported","notes":null},"secret_key":{"value":128,"unit":"byte","status":"reported","notes":null},"signature":{"encoding":"fixed","reported":51187,"minimum":51187,"maximum":51187,"average":51187,"unit":"byte","notes":null}}}
  ],
  "signing_behavior":{"rejection_sampling":false,"expected_repetitions":null,"signing_failure_probability":null,"retry_limit":null,"state_update":null,"notes":"Interactive proof is repeated tau times and made non-interactive; this is not lattice-style rejection sampling."},
  "security_claims":[{"target":"EUF-CMA","model":"ROM","claim":"Security theorem reduces forgery to NSBC, PRG security, commitment binding, and random-oracle terms.","estimates":[{"parameter_set":"Tins-128","classical_bits":137},{"parameter_set":"Tins-256","classical_bits":261},{"parameter_set":"Tins-512","classical_bits":521}]}],
  "submission_claims":{"claimed_advantages":[{"category":"compactness","summary":"Claims competitive public-key plus signature sizes for a T/ MPC-in-the-Head-style design.","claim_strength":"comparative","comparison_scope":"submission comparison table"},{"category":"security","summary":"Provides a game-based ROM security argument from NSBC and symmetric primitives.","claim_strength":"formal","comparison_scope":null}],"limitations_and_constraints":[{"category":"signature_size","summary":"Signature size grows from 3,284 to 51,187 bytes across the three security levels.","basis":"derived_from_parameters"},{"category":"performance","summary":"Signing and verification require hundreds to thousands of millions of cycles in the reported desktop benchmark.","basis":"derived_from_test_setup"},{"category":"platform_dependency","summary":"Optimized figures use AVX on a Windows 11 Intel Core i9-14900K test system.","basis":"derived_from_test_setup"}]},
  "independent_assessment":{"status":"not_started","advantages":[],"limitations":[]},"implementations":[{"type":"reference/optimized","language":"C","platform":"x86/AVX","path":"DigitalSignature/Tins/Implementations"}],"submission_completeness":{"basic_information":true,"algorithm_specification":true,"intellectual_property":true,"test_vectors":true,"implementation":true},
  "sources":[{"source_id":"tins-spec","type":"algorithm_specification","path":"DigitalSignature/Tins/Algorithm specifications/tins.pdf","extraction_method":"text","notes":null},{"source_id":"tins-basic","type":"basic_information","path":"DigitalSignature/Tins/Basic information/Appendix A Basic Algorithm Information.pdf","extraction_method":"text","notes":null}],
  "evidence":[{"field":"overview_classification","source_id":"tins-spec","locator":"title; Sections 2-3","confidence":"high","extraction_status":"verified","note":null},{"field":"parameter_sets","source_id":"tins-spec","locator":"p. 17 Table 2; Table 5","confidence":"high","extraction_status":"verified","note":null},{"field":"security_claims","source_id":"tins-spec","locator":"Section 6.1","confidence":"high","extraction_status":"extracted","note":null}],
  "review":{"status":"extracted","data_quality":"B","reviewers":["primary-agent"],"cross_reviewed":false,"issues":["Quantum-bit estimates are not separately stated in the extracted parameter table."],"conflicts":[],"last_updated":"2026-09-20"}
}
