{
  "schema_version":"1.0.0","algorithm_id":"dove","name":"DOVE","full_name":"Double Oil and Vinegar Scheme","version":"1.0","function":"digital_signature","submission_path":"DigitalSignature/DOVE","aliases":["DOVE_classic","DOVE_pkc_skc"],
  "overview_classification":{"family":"multivariate_based","subcategory":"oil_vinegar_based","family_label_en":"Multivariate","family_label_zh":"多变量密码","subcategory_label_en":"Oil-and-vinegar signature","subcategory_label_zh":"油醋型签名","summary_label_zh":"多变量密码 / 油醋型签名"},
  "technical_classification":{"construction_paradigm":["hash_and_sign","trapdoor_signature"],"hardness_problems":[{"name":"DOVE-MQ","role":"public-map inversion","details":"Inversion of the structured multivariate quadratic public map"},{"name":"DOVE-UOV","role":"trapdoor recovery","details":"Recovery of an equivalent oil-and-vinegar trapdoor"}],"mathematical_structures":["multivariate quadratic maps over GF(2^8)","unbalanced oil-and-vinegar","structured double vinegar-by-vinegar matrix factorization"],"claimed_security_targets":["EUF-CMA"],"claimed_security_models":["ROM"]},
  "signature_characteristics":{"statefulness":"stateless","signing_randomness":"randomized","signature_length":"fixed","message_recovery":false,"rejection_sampling":true,"prehash_mode":null,"context_support":null,"batch_verification":null},
  "affiliations":[{"affiliation_id":"aff-1","name_en":"China Construction Bank Corporation","name_zh":"中国建设银行股份有限公司","country_or_region":"China"}],
  "submitters":[{"name_en":"Yi Jin","name_zh":"金易","affiliation_ids":["aff-1"],"roles":["author","submitter","contact"]},{"name_en":"Yuansheng Pan","name_zh":"潘源盛","affiliation_ids":["aff-1"],"roles":["author","submitter"]},{"name_en":"Boru Gong","name_zh":"巩博儒","affiliation_ids":["aff-1"],"roles":["author","submitter"]}],
  "common_parameters":{"field":"GF(2^8) = F_2[x]/(x^8+x^4+x^3+x+1)","central_map":"UOV-derived Double Vinegar x Vinegar structured MQ map","hash_xof_prg":["XOF for seeded key expansion","message hash to GF(2^8)^m"],"encoding":"byte-field vectors with little-endian multi-byte encodings","signature_components":["salt","preimage vector"]},
  "parameter_sets":[
    {"name":"DOVE_classic_128","implementation_aliases":[],"target_security":{"classical_bits":128,"quantum_bits":80,"category":null},"parameters":{"o":44,"m":44,"n":112,"v":68,"q":256,"l":7,"salt_bytes":24,"variant":"classic"},"sizes":{"public_key":{"value":191646,"unit":"byte","status":"reported","notes":null},"secret_key":{"value":192990,"unit":"byte","status":"reported","notes":null},"signature":{"encoding":"fixed","reported":136,"minimum":136,"maximum":136,"average":136,"unit":"byte","notes":null}}},
    {"name":"DOVE_classic_256","implementation_aliases":[],"target_security":{"classical_bits":256,"quantum_bits":128,"category":null},"parameters":{"o":96,"m":96,"n":256,"v":160,"q":256,"l":10,"salt_bytes":40,"variant":"classic"},"sizes":{"public_key":{"value":2050352,"unit":"byte","status":"reported","notes":null},"secret_key":{"value":1925976,"unit":"byte","status":"reported","notes":null},"signature":{"encoding":"fixed","reported":296,"minimum":296,"maximum":296,"average":296,"unit":"byte","notes":null}}},
    {"name":"DOVE_classic_512","implementation_aliases":[],"target_security":{"classical_bits":512,"quantum_bits":256,"category":null},"parameters":{"o":216,"m":216,"n":576,"v":360,"q":256,"l":15,"salt_bytes":72,"variant":"classic"},"sizes":{"public_key":{"value":22833052,"unit":"byte","status":"reported","notes":null},"secret_key":{"value":20181508,"unit":"byte","status":"reported","notes":null},"signature":{"encoding":"fixed","reported":648,"minimum":648,"maximum":648,"average":648,"unit":"byte","notes":null}}},
    {"name":"DOVE_pkc_skc_128","implementation_aliases":[],"target_security":{"classical_bits":128,"quantum_bits":80,"category":null},"parameters":{"o":44,"m":44,"n":112,"v":68,"q":256,"l":7,"salt_bytes":24,"secret_seed_bytes":24,"public_seed_bytes":16,"variant":"public-and-secret-key compressed"},"sizes":{"public_key":{"value":43576,"unit":"byte","status":"reported","notes":null},"secret_key":{"value":24,"unit":"byte","status":"reported","notes":null},"signature":{"encoding":"fixed","reported":136,"minimum":136,"maximum":136,"average":136,"unit":"byte","notes":null}}},
    {"name":"DOVE_pkc_skc_256","implementation_aliases":[],"target_security":{"classical_bits":256,"quantum_bits":128,"category":null},"parameters":{"o":96,"m":96,"n":256,"v":160,"q":256,"l":10,"salt_bytes":40,"secret_seed_bytes":40,"public_seed_bytes":16,"variant":"public-and-secret-key compressed"},"sizes":{"public_key":{"value":446992,"unit":"byte","status":"reported","notes":null},"secret_key":{"value":40,"unit":"byte","status":"reported","notes":null},"signature":{"encoding":"fixed","reported":296,"minimum":296,"maximum":296,"average":296,"unit":"byte","notes":null}}},
    {"name":"DOVE_pkc_skc_512","implementation_aliases":[],"target_security":{"classical_bits":512,"quantum_bits":256,"category":null},"parameters":{"o":216,"m":216,"n":576,"v":360,"q":256,"l":15,"salt_bytes":72,"secret_seed_bytes":72,"public_seed_bytes":16,"variant":"public-and-secret-key compressed"},"sizes":{"public_key":{"value":5062192,"unit":"byte","status":"reported","notes":null},"secret_key":{"value":72,"unit":"byte","status":"reported","notes":null},"signature":{"encoding":"fixed","reported":648,"minimum":648,"maximum":648,"average":648,"unit":"byte","notes":null}}}
  ],
  "signing_behavior":{"rejection_sampling":true,"expected_repetitions":null,"signing_failure_probability":null,"retry_limit":null,"state_update":null,"notes":"Hash-and-sign samples vinegar variables/salt until the central system is invertible; no aggregate failure probability or retry cap was located."},
  "security_claims":[{"target":"EUF-CMA","model":"ROM","claim":"Submission claims a tight ROM reduction to DOVE-MQ inversion, DOVE-UOV trapdoor recovery and hash collisions.","estimates":[{"parameter_set":"DOVE128","classical_target_bits":160,"quantum_target_bits":80},{"parameter_set":"DOVE256","classical_target_bits":256,"quantum_target_bits":128},{"parameter_set":"DOVE512","classical_target_bits":512,"quantum_target_bits":256}]}],
  "submission_claims":{"claimed_advantages":[{"category":"performance","summary":"Structured factorization reduces XOF expansion, enables pipelined evaluation and lowers active memory relative to standard UOV.","claim_strength":"comparative","comparison_scope":"standard UOV design"},{"category":"compactness","summary":"Retains very short UOV-style signatures and offers seed-compressed secret keys in pkc-skc variants.","claim_strength":"quantitative","comparison_scope":"submitted variants"},{"category":"flexibility","summary":"Classic variants target precomputation-rich environments, while pkc-skc variants reduce key transmission/storage.","claim_strength":"qualitative","comparison_scope":"DOVE variant trade-off"}],"limitations_and_constraints":[{"category":"structural_assumption","summary":"The submission explicitly states uncertainty about whether base-matrix correlations enable new structural or algebraic attacks and calls for third-party cryptanalysis.","basis":"explicit_caveat"},{"category":"public_key_size","summary":"Even compressed public keys range from 43,576 bytes to 5,062,192 bytes; classic public keys are substantially larger.","basis":"derived_from_parameters"},{"category":"signing_retry","summary":"Hash-and-sign inversion may require retrying random vinegar choices.","basis":"derived_from_implementation_description"},{"category":"platform_benchmark_scope","summary":"Performance results cover supplied x86 reference and AVX2 implementations.","basis":"derived_from_test_setup"}]},
  "independent_assessment":{"status":"not_started","advantages":[],"limitations":[]},
  "implementations":[{"type":"reference","language":"C","platform":"x86","path":"DigitalSignature/DOVE/Implementations/Digital_Signature-DOVE-x86-reference_implementation.rar"},{"type":"optimized","language":"C/intrinsics","platform":"x86/AVX2","path":"DigitalSignature/DOVE/Implementations/Digital_Signature-DOVE-x86-performance_optimal_implementation.rar"}],
  "submission_completeness":{"basic_information":true,"algorithm_specification":true,"intellectual_property":true,"reference_implementation":true,"optimized_implementation":true,"test_vectors":true},
  "sources":[{"source_id":"dove-spec","type":"algorithm_specification","path":"DigitalSignature/DOVE/Algorithm specifications.pdf","extraction_method":"text","notes":"Version 1.0."},{"source_id":"dove-basic","type":"basic_information","path":"DigitalSignature/DOVE/Basic information.pdf","extraction_method":"text","notes":"Submitter names and Chinese names are extractable."}],
  "evidence":[{"field":"overview_classification","source_id":"dove-spec","locator":"pp. 3-5","confidence":"high","extraction_status":"verified","note":"Explicit UOV-derived multivariate hash-and-sign design."},{"field":"submitters","source_id":"dove-basic","locator":"p. 1","confidence":"high","extraction_status":"verified","note":null},{"field":"parameter_sets","source_id":"dove-spec","locator":"p. 10, Tables 1-2","confidence":"high","extraction_status":"verified","note":null},{"field":"submission_claims.limitations_and_constraints","source_id":"dove-spec","locator":"pp. 25-26, Summary and Future Work","confidence":"high","extraction_status":"verified","note":"Structural-risk caveat is explicit in the submission."}],
  "review":{"status":"reviewed","data_quality":"A","reviewers":["sig-group-1-agent","primary-agent"],"cross_reviewed":true,"issues":[],"conflicts":["The security discussion says the 128-bit profile is chosen for at least 160 classical bits before Grover, while the parameter-set label and call category are 128-bit classical; both scopes are retained."],"last_updated":"2026-09-20"}
}
