{
  "schema_version":"1.0.0","algorithm_id":"compass-sig","name":"COMPASS-SIG","full_name":"COMpact Post-quAntum Security Suite - Digital Signature","version":"1.2","function":"digital_signature","submission_path":"DigitalSignature/COMPASS-SIG","aliases":[],
  "overview_classification":{"family":"lattice_based","subcategory":"mlwe_msis_based","family_label_en":"Lattice-based","family_label_zh":"格密码","subcategory_label_en":"MLWE/MSIS-type signature","subcategory_label_zh":"MLWE-MSIS型签名","summary_label_zh":"格密码 / MLWE-MSIS型签名"},
  "technical_classification":{"construction_paradigm":["identification_to_signature","fiat_shamir_with_aborts"],"hardness_problems":[{"name":"MLWE","role":"key recovery","details":"Module Learning With Errors"},{"name":"MSIS/MISIS","role":"signature forgery","details":"Module short/inhomegeneous short integer solution"},{"name":"SelfTargetMSISR","role":"security reduction","details":"Relaxed self-target MSIS variant"},{"name":"Shell-MISIS/Shell-CVP","role":"enhanced forgery estimate","details":"Requires a sufficiently large Euclidean norm as well as bounded infinity norm"}],"mathematical_structures":["module lattice","R_q = Z_q[X]/(X^n+1)","NTT polynomial modules"],"claimed_security_targets":["SUF-CMA","UF-CMA"],"claimed_security_models":["ROM","QROM"]},
  "signature_characteristics":{"statefulness":"stateless","signing_randomness":"randomized","signature_length":"fixed","message_recovery":false,"rejection_sampling":true,"prehash_mode":null,"context_support":null,"batch_verification":null},
  "affiliations":[{"affiliation_id":"aff-1","name_en":"Shanghai Jiao Tong University","name_zh":"上海交通大学","country_or_region":"China"},{"affiliation_id":"aff-2","name_en":"Shanghai Zhixun Crypto Co. Ltd.","name_zh":null,"country_or_region":"China"}],
  "submitters":[{"name_en":"Geng Wang","name_zh":null,"affiliation_ids":["aff-1"],"roles":["author","contact"]},{"name_en":"Wenwen Xia","name_zh":null,"affiliation_ids":["aff-1"],"roles":["author"]},{"name_en":"Zhedong Wang","name_zh":null,"affiliation_ids":["aff-1"],"roles":["author"]},{"name_en":"Weidan Ji","name_zh":null,"affiliation_ids":["aff-1"],"roles":["author"]},{"name_en":"Wenyu He","name_zh":null,"affiliation_ids":["aff-1"],"roles":["author"]},{"name_en":"Ningyue Zhang","name_zh":null,"affiliation_ids":["aff-1"],"roles":["author"]},{"name_en":"Fei Duan","name_zh":null,"affiliation_ids":["aff-1"],"roles":["author"]},{"name_en":"Xinyang Geng","name_zh":null,"affiliation_ids":["aff-1"],"roles":["author"]},{"name_en":"Jihong Li","name_zh":null,"affiliation_ids":["aff-2"],"roles":["author"]}],
  "common_parameters":{"ring":"Z_q[X]/(X^n+1)","secret_distribution":"coefficients in {-1,0,1}","challenge_space":"fixed-weight sparse polynomial","delta":4,"hash_xof_prg":["SHAKE/FIPS-202-style XOF"],"encoding":"compressed public key; signature omits ML-DSA-style hint vector","signature_components":["z","c"]},
  "parameter_sets":[
    {"name":"COMPASS-SIG-128","implementation_aliases":[],"target_security":{"classical_bits":128,"quantum_bits":80,"category":null},"parameters":{"q":2081281,"n":256,"k":3,"l":4,"eta_s":1,"eta_e":1,"d":4,"gamma1":32768,"gamma2":130080,"tau":30,"B":560},"sizes":{"public_key":{"value":1664,"unit":"byte","status":"reported","notes":null},"secret_key":{"value":960,"unit":"byte","status":"reported","notes":null},"signature":{"encoding":"fixed","reported":2080,"minimum":2080,"maximum":2080,"average":2080,"unit":"byte","notes":null}}},
    {"name":"COMPASS-SIG-256","implementation_aliases":[],"target_security":{"classical_bits":256,"quantum_bits":128,"category":null},"parameters":{"q":2081281,"n":256,"k":7,"l":7,"eta_s":1,"eta_e":1,"d":5,"gamma1":131072,"gamma2":520320,"tau":60,"B":1120},"sizes":{"public_key":{"value":3616,"unit":"byte","status":"reported","notes":null},"secret_key":{"value":2144,"unit":"byte","status":"reported","notes":null},"signature":{"encoding":"fixed","reported":4080,"minimum":4080,"maximum":4080,"average":4080,"unit":"byte","notes":null}}},
    {"name":"COMPASS-SIG-384","implementation_aliases":[],"target_security":{"classical_bits":384,"quantum_bits":192,"category":null},"parameters":{"q":8380417,"n":512,"k":5,"l":6,"eta_s":1,"eta_e":1,"d":5,"gamma1":262144,"gamma2":1047552,"tau":78,"B":1760},"sizes":{"public_key":{"value":5792,"unit":"byte","status":"reported","notes":null},"secret_key":{"value":3136,"unit":"byte","status":"reported","notes":null},"signature":{"encoding":"fixed","reported":7344,"minimum":7344,"maximum":7344,"average":7344,"unit":"byte","notes":null}}},
    {"name":"COMPASS-SIG-512","implementation_aliases":[],"target_security":{"classical_bits":512,"quantum_bits":256,"category":null},"parameters":{"q":8380417,"n":512,"k":7,"l":7,"eta_s":1,"eta_e":1,"d":5,"gamma1":524288,"gamma2":2095104,"tau":120,"B":2240},"sizes":{"public_key":{"value":7648,"unit":"byte","status":"reported","notes":null},"secret_key":{"value":4608,"unit":"byte","status":"reported","notes":null},"signature":{"encoding":"fixed","reported":9024,"minimum":9024,"maximum":9024,"average":9024,"unit":"byte","notes":null}}}
  ],
  "signing_behavior":{"rejection_sampling":true,"expected_repetitions":{"COMPASS-SIG-128":3.09,"COMPASS-SIG-256":2.88,"COMPASS-SIG-384":3.25,"COMPASS-SIG-512":2.99},"signing_failure_probability":0,"retry_limit":null,"state_update":null,"notes":"The submission says rejected candidates increase time but valid signatures always verify."},
  "security_claims":[{"target":"SUF-CMA","model":"ROM","claim":"Submission analyzes strong unforgeability under MLWE and MSIS-family assumptions in the random-oracle model.","estimates":[]},{"target":"SUF-CMA","model":"QROM","claim":"Submission invokes Fiat-Shamir-with-aborts QROM analyses for quantum security.","estimates":[]}],
  "submission_claims":{"claimed_advantages":[{"category":"compactness","summary":"Claims substantially shorter signatures than ML-DSA at the cost of larger public keys, and lower pk + 2*sig communication at 128/256 bits.","claim_strength":"comparative","comparison_scope":"ML-DSA comparison in specification"},{"category":"performance","summary":"Reports faster key generation, signing and verification than compared ML-DSA reference implementations at 128 and 256 bits.","claim_strength":"quantitative","comparison_scope":"submission x86 benchmark"},{"category":"simplicity","summary":"Removes hint vectors and uses integer/NTT/hash operations without Gaussian sampling.","claim_strength":"qualitative","comparison_scope":"design comparison with ML-DSA"},{"category":"side_channel_protection","summary":"Claims deterministic rejection checks can be implemented in constant time.","claim_strength":"qualitative","comparison_scope":"implementation design"}],"limitations_and_constraints":[{"category":"rejection_sampling","summary":"Signing averages 2.88 to 3.25 iterations across submitted parameter sets.","basis":"explicit_in_submission"},{"category":"public_key_size","summary":"Public keys are deliberately larger than ML-DSA to reduce signature size.","basis":"explicit_caveat"},{"category":"new_hardness_assumption","summary":"Enhanced forgery estimates use Shell-MISIS/Shell-CVP; the submission also provides fallback estimates without relying on the shell variant.","basis":"explicit_in_submission"},{"category":"platform_benchmark_scope","summary":"Performance was measured on an AMD Ryzen 7 8745HS virtualized Ubuntu workstation and AVX2 implementation.","basis":"derived_from_test_setup"}]},
  "independent_assessment":{"status":"not_started","advantages":[],"limitations":[]},
  "implementations":[{"type":"reference","language":"C","platform":"portable","path":"DigitalSignature/COMPASS-SIG/Implementations/Reference_Implementation"},{"type":"optimized","language":"C","platform":"AVX2","path":"DigitalSignature/COMPASS-SIG/Implementations/Optimized_Implementation"}],
  "submission_completeness":{"basic_information":true,"algorithm_specification":true,"intellectual_property":true,"reference_implementation":true,"optimized_implementation":true,"test_vectors":true},
  "sources":[{"source_id":"compass-spec","type":"algorithm_specification","path":"DigitalSignature/COMPASS-SIG/Algorithm specifications.pdf","extraction_method":"text","notes":"Version 1.2, June 2026."},{"source_id":"compass-basic","type":"basic_information","path":"DigitalSignature/COMPASS-SIG/Basic information.pdf","extraction_method":"ocr","notes":"Scanned form; OCR used for submitter affiliation assignment."}],
  "evidence":[{"field":"overview_classification","source_id":"compass-spec","locator":"p. 1","confidence":"high","extraction_status":"verified","note":"Explicitly module-lattice Fiat-Shamir with aborts."},{"field":"submitters","source_id":"compass-basic","locator":"pp. 1-3","confidence":"medium","extraction_status":"extracted","note":"Names cross-checked with specification title page."},{"field":"parameter_sets","source_id":"compass-spec","locator":"pp. 12-14, Tables 1-2","confidence":"high","extraction_status":"verified","note":null},{"field":"signing_behavior.expected_repetitions","source_id":"compass-spec","locator":"p. 14, Section 3.4","confidence":"high","extraction_status":"verified","note":null}],
  "review":{"status":"extracted","data_quality":"B","reviewers":["sig-group-1-agent"],"cross_reviewed":false,"issues":["Chinese personal names were not reliably recoverable from the scanned basic-information form and are null.","The specification title page lists two organizations collectively; the OCR form was used to assign Jihong Li to Shanghai Zhixun Crypto and the other authors to Shanghai Jiao Tong University."],"conflicts":[],"last_updated":"2026-09-20"}
}
