{
  "schema_version":"1.0.0","algorithm_id":"facto-dsa","name":"Facto-DSA","full_name":"Cubic Factorisation Based Multivariate Digital Signature Algorithm","version":null,"function":"digital_signature","submission_path":"DigitalSignature/Facto-DSA","aliases":[],
  "overview_classification":{"family":"multivariate_based","subcategory":"other_multivariate_based","family_label_en":"Multivariate","family_label_zh":"多变量密码","subcategory_label_en":"Other multivariate signature","subcategory_label_zh":"其他多变量签名","summary_label_zh":"多变量密码 / 三次因式分解型签名"},
  "technical_classification":{"construction_paradigm":["hash_and_sign","trapdoor_signature"],"hardness_problems":[{"name":"Facto-DSA public inversion","role":"signature forgery","details":"Inverting the published dense homogeneous cubic map"},{"name":"Facto-DSA trapdoor recovery","role":"key recovery","details":"Recovering equivalent hidden input/output maps and triangular quadratic structure"},{"name":"polynomial factorisation with bounded split","role":"legitimate trapdoor inversion","details":"Signer factors completed target polynomial and inverts a hidden triangular quadratic map"}],"mathematical_structures":["homogeneous cubic polynomial systems over F_65519","polynomial multiplication in F_q[t]","Isomorphism of Polynomials IP2","triangular quadratic maps"],"claimed_security_targets":["EUF-CMA"],"claimed_security_models":["ROM","QROM"]},
  "signature_characteristics":{"statefulness":"stateless","signing_randomness":"randomized","signature_length":"fixed","message_recovery":false,"rejection_sampling":true,"prehash_mode":null,"context_support":null,"batch_verification":null},
  "affiliations":[{"affiliation_id":"aff-1","name_en":"Develrox Chile","name_zh":null,"country_or_region":"Chile"}],
  "submitters":[{"name_en":"Borja Gomez","name_zh":null,"affiliation_ids":["aff-1"],"roles":["author","submitter","contact","implementer"]}],
  "common_parameters":{"field":"F_q with q=65519 (q congruent 3 mod 4)","central_map":"(X,Y) -> (Q(X)+R(Y))*Y followed by hidden input maps and output projection","public_map_degree":3,"hash_xof_prg":["domain-separated message hash with public-key digest"],"encoding":"two bytes per field element","signature_components":["z in F_q^(2n)"]},
  "parameter_sets":[
    {"name":"Facto-DSA-128","implementation_aliases":[],"target_security":{"classical_bits":128,"quantum_bits":80,"category":null},"parameters":{"q":65519,"n":10,"r":20,"D":19,"m":13,"s":6,"Rmax":512,"one_trial_success_lower_bound":0.26},"sizes":{"public_key":{"value":40040,"unit":"byte","status":"reported","notes":null},"secret_key":{"value":3094,"unit":"byte","status":"reported","notes":null},"signature":{"encoding":"fixed","reported":40,"minimum":40,"maximum":40,"average":40,"unit":"byte","notes":null}}},
    {"name":"Facto-DSA-256","implementation_aliases":[],"target_security":{"classical_bits":256,"quantum_bits":128,"category":null},"parameters":{"q":65519,"n":17,"r":34,"D":33,"m":32,"s":1,"Rmax":1024,"one_trial_success_lower_bound":0.22},"sizes":{"public_key":{"value":456960,"unit":"byte","status":"reported","notes":null},"secret_key":{"value":11662,"unit":"byte","status":"reported","notes":null},"signature":{"encoding":"fixed","reported":68,"minimum":68,"maximum":68,"average":68,"unit":"byte","notes":null}}},
    {"name":"Facto-DSA-512","implementation_aliases":[],"target_security":{"classical_bits":512,"quantum_bits":256,"category":null},"parameters":{"q":65519,"n":32,"r":64,"D":63,"m":62,"s":1,"Rmax":2048,"one_trial_success_lower_bound":0.19},"sizes":{"public_key":{"value":5674240,"unit":"byte","status":"reported","notes":null},"secret_key":{"value":61922,"unit":"byte","status":"reported","notes":null},"signature":{"encoding":"fixed","reported":128,"minimum":128,"maximum":128,"average":128,"unit":"byte","notes":null}}}
  ],
  "signing_behavior":{"rejection_sampling":true,"expected_repetitions":{"Facto-DSA-128":"at most about 1/0.26 from the conservative lower bound","Facto-DSA-256":"at most about 1/0.22 from the conservative lower bound","Facto-DSA-512":"at most about 1/0.19 from the conservative lower bound"},"signing_failure_probability":"Facto-DSA-128 <2^-222; Facto-DSA-256 <2^-367; Facto-DSA-512 <2^-622","retry_limit":null,"state_update":null,"notes":"Per-set retry limits are stored in parameters as Rmax=512/1024/2048; schema has only one common retry_limit field."},
  "security_claims":[{"target":"EUF-CMA","model":"ROM","claim":"Submission claims classical EUF-CMA under the Facto-DSA public-inversion assumption with bad-event terms for signing failure and hash collisions.","estimates":[]},{"target":"EUF-CMA","model":"QROM","claim":"Submission states a QROM analogue with quantum random-oracle query losses.","estimates":[]}],
  "submission_claims":{"claimed_advantages":[{"category":"compactness","summary":"Produces exceptionally short fixed signatures of 40, 68 and 128 bytes.","claim_strength":"quantitative","comparison_scope":"submitted parameter sets"},{"category":"simplicity","summary":"Uses linear, polynomial and modular algebra and a portable ISO C interface without external libraries.","claim_strength":"qualitative","comparison_scope":"implementation"},{"category":"flexibility","summary":"Parameters n, m, output-minus dimension and retry bound can be adjusted for new cost data.","claim_strength":"qualitative","comparison_scope":"design space"},{"category":"implementation","summary":"Provides portable, performance-optimized and resource-optimized versions across x86-64, ARM and RISC-V.","claim_strength":"qualitative","comparison_scope":"submission package"}],"limitations_and_constraints":[{"category":"public_key_size","summary":"Dense cubic public keys range from 40,040 bytes to 5,674,240 bytes and dominate transmission when sent with a message.","basis":"explicit_in_submission"},{"category":"signing_failure","summary":"Signing is probabilistic and capped at 512/1024/2048 trials, with claimed failure below 2^-222/2^-367/2^-622.","basis":"explicit_in_submission"},{"category":"structural_assumption","summary":"Security depends on a new cubic factorisation-based public inversion/trapdoor-recovery assumption following attacks on earlier quadratic factorisation schemes.","basis":"explicit_in_submission"},{"category":"platform_benchmark_scope","summary":"Performance tables cover specific x86-64, ARM and RISC-V systems and multiple implementation profiles.","basis":"derived_from_test_setup"}]},
  "independent_assessment":{"status":"not_started","advantages":[],"limitations":[]},
  "implementations":[{"type":"reference","language":"C","platform":"portable/multiple","path":"DigitalSignature/Facto-DSA/Implementations and Test_Vectors/self-assesment"},{"type":"optimized","language":"C/intrinsics","platform":"x86-64/ARM/RISC-V","path":"DigitalSignature/Facto-DSA/Implementations and Test_Vectors/self-assesment"}],
  "submission_completeness":{"basic_information":true,"algorithm_specification":true,"intellectual_property":true,"reference_implementation":true,"optimized_implementation":true,"test_vectors":true},
  "sources":[{"source_id":"facto-spec","type":"algorithm_specification","path":"DigitalSignature/Facto-DSA/Algorithm Specification/algorithm-specification-facto-dsa.pdf","extraction_method":"text","notes":"Specification dated June 2026."},{"source_id":"facto-basic","type":"basic_information","path":"DigitalSignature/Facto-DSA/Basic Information.pdf","extraction_method":"text","notes":"Basic-information form embedded as appendix in specification and separately supplied."}],
  "evidence":[{"field":"overview_classification","source_id":"facto-spec","locator":"Abstract and pp. 3-6","confidence":"high","extraction_status":"verified","note":"Explicit cubic multivariate factorisation construction."},{"field":"submitters","source_id":"facto-basic","locator":"p. 1","confidence":"high","extraction_status":"verified","note":null},{"field":"parameter_sets","source_id":"facto-spec","locator":"p. 16, Table 2","confidence":"high","extraction_status":"verified","note":null},{"field":"signing_behavior","source_id":"facto-spec","locator":"pp. 17-19, Section 2.3","confidence":"high","extraction_status":"verified","note":null}],
  "review":{"status":"extracted","data_quality":"A","reviewers":["sig-group-1-agent"],"cross_reviewed":false,"issues":["The taxonomy has no dedicated cubic-factorisation multivariate subcategory, so other_multivariate_based is used and the exact construction is recorded technically."],"conflicts":[],"last_updated":"2026-09-20"}
}
