{
  "schema_version":"1.0.0","algorithm_id":"cedrus-alpha","name":"cedrus-α","full_name":"CEDRUSα: A Stateless Hash-based Signature Scheme","version":null,"function":"digital_signature","submission_path":"DigitalSignature/cedrus-α","aliases":["CEDRUSα","CEDRUS-alpha"],
  "overview_classification":{"family":"hash_based","subcategory":"merkle_tree_based","family_label_en":"Hash-based","family_label_zh":"哈希密码","subcategory_label_en":"Merkle-tree signature","subcategory_label_zh":"Merkle树签名","summary_label_zh":"哈希密码 / 无状态Merkle树签名"},
  "technical_classification":{"construction_paradigm":["merkle_tree_composition","one_time_signature_composition"],"hardness_problems":[{"name":"hash-function preimage/second-preimage and collision resistance","role":"unforgeability","details":null}],"mathematical_structures":["hypertree","XMSS","inhomogeneous WOTS-alpha","FORC few-time signature"],"claimed_security_targets":["EUF-CMA"],"claimed_security_models":["ROM"]},
  "signature_characteristics":{"statefulness":"stateless","signing_randomness":"hedged","signature_length":"fixed","message_recovery":false,"rejection_sampling":true,"prehash_mode":"HMSG over randomized digest","context_support":null,"batch_verification":null},
  "affiliations":[{"affiliation_id":"aff-1","name_en":"University of Chinese Academy of Sciences","name_zh":"中国科学院大学","country_or_region":"China"}],
  "submitters":[{"name_en":"Siwei Sun","name_zh":"孙思维","affiliation_ids":["aff-1"],"roles":["author","submitter","contact"]},{"name_en":"Zhen Qin","name_zh":"秦臻","affiliation_ids":["aff-1"],"roles":["author","submitter"]},{"name_en":"Fangyu Zheng","name_zh":"郑昉昱","affiliation_ids":["aff-1"],"roles":["author","submitter"]},{"name_en":"Zhiyu Zhang","name_zh":"张志宇","affiliation_ids":["aff-1"],"roles":["author","submitter"]}],
  "common_parameters":{"secret_key":"(SK.seed, SK.prf, PK.root, PK.seed)","public_key":"(PK.root, PK.seed)","tree_components":["XMSS","CEDRUS-alpha hypertree","FORC"],"hash_xof_prg":["SM3-derived hash/XOF for submitted instances"],"signature_components":["randomizer R","FORC signature","hypertree signature"]},
  "parameter_sets":[
    {"name":"CEDRUSα-160s","implementation_aliases":[],"target_security":{"classical_bits":160,"quantum_bits":80,"category":"small signature"},"parameters":{"n":20,"h":68,"d":9,"a":10,"k":16,"w_prime":8,"len":30},"sizes":{"public_key":{"value":40,"unit":"byte","status":"reported","notes":null},"secret_key":{"value":80,"unit":"byte","status":"reported","notes":null},"signature":{"encoding":"fixed","reported":10300,"minimum":10300,"maximum":10300,"average":10300,"unit":"byte","notes":null}}},
    {"name":"CEDRUSα-160f","implementation_aliases":[],"target_security":{"classical_bits":160,"quantum_bits":80,"category":"fast"},"parameters":{"n":20,"h":66,"d":17,"a":7,"k":28,"w_prime":4,"len":40},"sizes":{"public_key":{"value":40,"unit":"byte","status":"reported","notes":null},"secret_key":{"value":80,"unit":"byte","status":"reported","notes":null},"signature":{"encoding":"fixed","reported":19420,"minimum":19420,"maximum":19420,"average":19420,"unit":"byte","notes":null}}},
    {"name":"CEDRUSα-256s","implementation_aliases":[],"target_security":{"classical_bits":256,"quantum_bits":128,"category":"small signature"},"parameters":{"n":32,"h":67,"d":9,"a":12,"k":23,"w_prime":4,"len":48},"sizes":{"public_key":{"value":64,"unit":"byte","status":"reported","notes":null},"secret_key":{"value":128,"unit":"byte","status":"reported","notes":null},"signature":{"encoding":"fixed","reported":25568,"minimum":25568,"maximum":25568,"average":25568,"unit":"byte","notes":null}}},
    {"name":"CEDRUSα-256f","implementation_aliases":[],"target_security":{"classical_bits":256,"quantum_bits":128,"category":"fast"},"parameters":{"n":32,"h":65,"d":14,"a":8,"k":45,"w_prime":2,"len":63},"sizes":{"public_key":{"value":64,"unit":"byte","status":"reported","notes":null},"secret_key":{"value":128,"unit":"byte","status":"reported","notes":null},"signature":{"encoding":"fixed","reported":43296,"minimum":43296,"maximum":43296,"average":43296,"unit":"byte","notes":null}}},
    {"name":"CEDRUSα-384s","implementation_aliases":[],"target_security":{"classical_bits":384,"quantum_bits":192,"category":"small signature"},"parameters":{"n":48,"h":65,"d":8,"a":12,"k":38,"w_prime":4,"len":88},"sizes":{"public_key":{"value":96,"unit":"byte","status":"reported","notes":null},"secret_key":{"value":192,"unit":"byte","status":"reported","notes":null},"signature":{"encoding":"fixed","reported":60672,"minimum":60672,"maximum":60672,"average":60672,"unit":"byte","notes":null}}},
    {"name":"CEDRUSα-384f","implementation_aliases":[],"target_security":{"classical_bits":384,"quantum_bits":192,"category":"fast"},"parameters":{"n":48,"h":65,"d":12,"a":10,"k":51,"w_prime":2,"len":80},"sizes":{"public_key":{"value":96,"unit":"byte","status":"reported","notes":null},"secret_key":{"value":192,"unit":"byte","status":"reported","notes":null},"signature":{"encoding":"fixed","reported":76176,"minimum":76176,"maximum":76176,"average":76176,"unit":"byte","notes":null}}},
    {"name":"CEDRUSα-512s","implementation_aliases":[],"target_security":{"classical_bits":512,"quantum_bits":256,"category":"small signature"},"parameters":{"n":64,"h":65,"d":8,"a":13,"k":47,"w_prime":4,"len":101},"sizes":{"public_key":{"value":128,"unit":"byte","status":"reported","notes":null},"secret_key":{"value":256,"unit":"byte","status":"reported","notes":null},"signature":{"encoding":"fixed","reported":98048,"minimum":98048,"maximum":98048,"average":98048,"unit":"byte","notes":null}}},
    {"name":"CEDRUSα-512f","implementation_aliases":[],"target_security":{"classical_bits":512,"quantum_bits":256,"category":"fast"},"parameters":{"n":64,"h":66,"d":11,"a":10,"k":66,"w_prime":4,"len":109},"sizes":{"public_key":{"value":128,"unit":"byte","status":"reported","notes":null},"secret_key":{"value":256,"unit":"byte","status":"reported","notes":null},"signature":{"encoding":"fixed","reported":127488,"minimum":127488,"maximum":127488,"average":127488,"unit":"byte","notes":null}}}
  ],
  "signing_behavior":{"rejection_sampling":true,"expected_repetitions":null,"signing_failure_probability":null,"retry_limit":null,"state_update":null,"notes":"The message-digest/counter procedure searches for an encodable FORC instance."},
  "security_claims":[{"target":"EUF-CMA","model":"ROM","claim":"Security is argued from component OTS/FORC and hypertree security under random-oracle-style hash assumptions.","estimates":[]}],
  "submission_claims":{"claimed_advantages":[{"category":"security","summary":"Claims security based solely on standard hash-function assumptions.","claim_strength":"qualitative","comparison_scope":"hash-based signatures"},{"category":"simplicity","summary":"Stateless construction avoids persistent signing state.","claim_strength":"qualitative","comparison_scope":null},{"category":"flexibility","summary":"Offers small-signature and fast variants at four security targets.","claim_strength":"quantitative","comparison_scope":null}],"limitations_and_constraints":[{"category":"signature_size","summary":"Fixed signatures range from 10,300 to 127,488 bytes.","basis":"derived_from_parameters"},{"category":"hash_instantiation","summary":"The specification warns that SM3-derived XOF idealization may not attain the labeled security and recommends secure replacement primitives.","basis":"explicit_caveat"},{"category":"performance_tradeoff","summary":"Fast variants use substantially larger signatures than small-signature variants.","basis":"derived_from_parameters"}]},
  "independent_assessment":{"status":"not_started","advantages":[],"limitations":[]},"implementations":[{"type":"reference/optimized","language":"C","platform":"portable/x86","path":"DigitalSignature/cedrus-α/Implementations"}],"submission_completeness":{"basic_information":true,"algorithm_specification":true,"intellectual_property":true,"test_vectors":true,"implementation":true},
  "sources":[{"source_id":"cedrusa-basic","type":"basic_information","path":"DigitalSignature/cedrus-α/Basic information/算法基本信息-英文.pdf","extraction_method":"text","notes":null},{"source_id":"cedrusa-spec","type":"algorithm_specification","path":"DigitalSignature/cedrus-α/Algorithm specifications.pdf","extraction_method":"text","notes":null}],
  "evidence":[{"field":"submitters","source_id":"cedrusa-basic","locator":"Appendix A","confidence":"high","extraction_status":"verified","note":"Phone, private email, and postal address excluded."},{"field":"parameter_sets","source_id":"cedrusa-spec","locator":"Table 1.1","confidence":"high","extraction_status":"verified","note":null},{"field":"submission_claims.limitations_and_constraints","source_id":"cedrusa-spec","locator":"Warning preceding Table 1.1","confidence":"high","extraction_status":"verified","note":null}],
  "review":{"status":"extracted","data_quality":"A","reviewers":["primary-agent"],"cross_reviewed":false,"issues":[],"conflicts":[],"last_updated":"2026-09-20"}
}
